{
  "source": "Aviary paired answer citation domain reach comparison",
  "schemaVersion": 1,
  "summary": {
    "row_type": "summary",
    "provider": null,
    "domain": null,
    "baseline_provider_prompt_groups": null,
    "current_provider_prompt_groups": null,
    "shared_exact_prompt_groups": null,
    "comparable_prompt_groups": null,
    "unknown_domain_prompt_groups": null,
    "baseline_present_prompts": null,
    "current_present_prompts": null,
    "gained_prompts": null,
    "lost_prompts": null,
    "present_both_periods": null,
    "absent_both_periods": null,
    "baseline_reach_percent": null,
    "current_reach_percent": null,
    "reach_change_percentage_points": null,
    "paired_prompt_bootstrap_ci95_lower_pp": null,
    "paired_prompt_bootstrap_ci95_upper_pp": null,
    "leave_one_prompt_out_minimum_change_pp": null,
    "leave_one_prompt_out_maximum_change_pp": null,
    "exact_two_sided_mcnemar_p_value": null,
    "holm_adjusted_mcnemar_p_value": null,
    "holm_family_size": 3,
    "paired_prompt_bootstrap_resamples": 1000,
    "comparison_complete": false,
    "prompt_catalog_complete": true,
    "domain_catalog_complete": true,
    "source_detail_complete": true,
    "holm_family_complete": true,
    "output_rows_truncated": false,
    "interpretation_note": "Each exact normalized prompt counts once within a provider after pooling repeated captures. Rows compare only provider/prompt groups present in both samples; capped per-prompt domain lists create unknown states rather than false absences. Reach deltas use only prompt pairs with known presence in both periods. Model, surface, locale, topic, intent, and repeated-capture context are pooled within each provider/prompt group and should be held stable for a controlled comparison. Exact McNemar and paired-prompt bootstrap values are descriptive for this manually sampled panel; Holm adjustment spans testable provider/domain rows only when the retained prompt and domain detail is complete. This describes captured answers, not engine visibility or causation."
  },
  "rows": [
    {
      "row_type": "domain-provider",
      "provider": "ChatGPT Search",
      "domain": "design.example.org",
      "baseline_provider_prompt_groups": 1,
      "current_provider_prompt_groups": 1,
      "shared_exact_prompt_groups": 1,
      "comparable_prompt_groups": 1,
      "unknown_domain_prompt_groups": 0,
      "baseline_present_prompts": 0,
      "current_present_prompts": 1,
      "gained_prompts": 1,
      "lost_prompts": 0,
      "present_both_periods": 0,
      "absent_both_periods": 0,
      "baseline_reach_percent": 0,
      "current_reach_percent": 100,
      "reach_change_percentage_points": 100,
      "paired_prompt_bootstrap_ci95_lower_pp": null,
      "paired_prompt_bootstrap_ci95_upper_pp": null,
      "leave_one_prompt_out_minimum_change_pp": null,
      "leave_one_prompt_out_maximum_change_pp": null,
      "exact_two_sided_mcnemar_p_value": 1,
      "holm_adjusted_mcnemar_p_value": 1,
      "holm_family_size": 3,
      "paired_prompt_bootstrap_resamples": 1000,
      "comparison_complete": true,
      "prompt_catalog_complete": true,
      "domain_catalog_complete": true,
      "source_detail_complete": true,
      "holm_family_complete": true,
      "output_rows_truncated": false,
      "interpretation_note": "Each exact normalized prompt counts once within a provider after pooling repeated captures. Rows compare only provider/prompt groups present in both samples; capped per-prompt domain lists create unknown states rather than false absences. Reach deltas use only prompt pairs with known presence in both periods. Model, surface, locale, topic, intent, and repeated-capture context are pooled within each provider/prompt group and should be held stable for a controlled comparison. Exact McNemar and paired-prompt bootstrap values are descriptive for this manually sampled panel; Holm adjustment spans testable provider/domain rows only when the retained prompt and domain detail is complete. This describes captured answers, not engine visibility or causation."
    },
    {
      "row_type": "domain-provider",
      "provider": "ChatGPT Search",
      "domain": "example.com",
      "baseline_provider_prompt_groups": 1,
      "current_provider_prompt_groups": 1,
      "shared_exact_prompt_groups": 1,
      "comparable_prompt_groups": 1,
      "unknown_domain_prompt_groups": 0,
      "baseline_present_prompts": 0,
      "current_present_prompts": 1,
      "gained_prompts": 1,
      "lost_prompts": 0,
      "present_both_periods": 0,
      "absent_both_periods": 0,
      "baseline_reach_percent": 0,
      "current_reach_percent": 100,
      "reach_change_percentage_points": 100,
      "paired_prompt_bootstrap_ci95_lower_pp": null,
      "paired_prompt_bootstrap_ci95_upper_pp": null,
      "leave_one_prompt_out_minimum_change_pp": null,
      "leave_one_prompt_out_maximum_change_pp": null,
      "exact_two_sided_mcnemar_p_value": 1,
      "holm_adjusted_mcnemar_p_value": 1,
      "holm_family_size": 3,
      "paired_prompt_bootstrap_resamples": 1000,
      "comparison_complete": true,
      "prompt_catalog_complete": true,
      "domain_catalog_complete": true,
      "source_detail_complete": true,
      "holm_family_complete": true,
      "output_rows_truncated": false,
      "interpretation_note": "Each exact normalized prompt counts once within a provider after pooling repeated captures. Rows compare only provider/prompt groups present in both samples; capped per-prompt domain lists create unknown states rather than false absences. Reach deltas use only prompt pairs with known presence in both periods. Model, surface, locale, topic, intent, and repeated-capture context are pooled within each provider/prompt group and should be held stable for a controlled comparison. Exact McNemar and paired-prompt bootstrap values are descriptive for this manually sampled panel; Holm adjustment spans testable provider/domain rows only when the retained prompt and domain detail is complete. This describes captured answers, not engine visibility or causation."
    },
    {
      "row_type": "domain-provider",
      "provider": "ChatGPT Search",
      "domain": "standards.example.net",
      "baseline_provider_prompt_groups": 1,
      "current_provider_prompt_groups": 1,
      "shared_exact_prompt_groups": 1,
      "comparable_prompt_groups": 1,
      "unknown_domain_prompt_groups": 0,
      "baseline_present_prompts": 0,
      "current_present_prompts": 1,
      "gained_prompts": 1,
      "lost_prompts": 0,
      "present_both_periods": 0,
      "absent_both_periods": 0,
      "baseline_reach_percent": 0,
      "current_reach_percent": 100,
      "reach_change_percentage_points": 100,
      "paired_prompt_bootstrap_ci95_lower_pp": null,
      "paired_prompt_bootstrap_ci95_upper_pp": null,
      "leave_one_prompt_out_minimum_change_pp": null,
      "leave_one_prompt_out_maximum_change_pp": null,
      "exact_two_sided_mcnemar_p_value": 1,
      "holm_adjusted_mcnemar_p_value": 1,
      "holm_family_size": 3,
      "paired_prompt_bootstrap_resamples": 1000,
      "comparison_complete": true,
      "prompt_catalog_complete": true,
      "domain_catalog_complete": true,
      "source_detail_complete": true,
      "holm_family_complete": true,
      "output_rows_truncated": false,
      "interpretation_note": "Each exact normalized prompt counts once within a provider after pooling repeated captures. Rows compare only provider/prompt groups present in both samples; capped per-prompt domain lists create unknown states rather than false absences. Reach deltas use only prompt pairs with known presence in both periods. Model, surface, locale, topic, intent, and repeated-capture context are pooled within each provider/prompt group and should be held stable for a controlled comparison. Exact McNemar and paired-prompt bootstrap values are descriptive for this manually sampled panel; Holm adjustment spans testable provider/domain rows only when the retained prompt and domain detail is complete. This describes captured answers, not engine visibility or causation."
    },
    {
      "row_type": "domain-provider",
      "provider": "Claude",
      "domain": "design.example.org",
      "baseline_provider_prompt_groups": 0,
      "current_provider_prompt_groups": 1,
      "shared_exact_prompt_groups": 0,
      "comparable_prompt_groups": 0,
      "unknown_domain_prompt_groups": 0,
      "baseline_present_prompts": 0,
      "current_present_prompts": 0,
      "gained_prompts": 0,
      "lost_prompts": 0,
      "present_both_periods": 0,
      "absent_both_periods": 0,
      "baseline_reach_percent": null,
      "current_reach_percent": null,
      "reach_change_percentage_points": null,
      "paired_prompt_bootstrap_ci95_lower_pp": null,
      "paired_prompt_bootstrap_ci95_upper_pp": null,
      "leave_one_prompt_out_minimum_change_pp": null,
      "leave_one_prompt_out_maximum_change_pp": null,
      "exact_two_sided_mcnemar_p_value": null,
      "holm_adjusted_mcnemar_p_value": null,
      "holm_family_size": 3,
      "paired_prompt_bootstrap_resamples": 1000,
      "comparison_complete": true,
      "prompt_catalog_complete": true,
      "domain_catalog_complete": true,
      "source_detail_complete": true,
      "holm_family_complete": true,
      "output_rows_truncated": false,